"post_number","category","post_text","hashtags"
"46","Git for ML","I maintain 176+ GitHub repositories. Here's my confession: my Git hygiene for ML was terrible for the first two years.

Code versioned? Yes. Data versioned? No. Model weights tracked? Sometimes. Experiment configs? Scattered across Slack messages and sticky notes. Reproducibility? ""Let me try to remember what I changed...""

Sound familiar?

ML needs version control for EVERYTHING, not just code. Data (use DVC). Models (MLflow Model Registry). Experiments (Weights & Biases or MLflow). Configurations (Hydra or OmegaConf).

My current workflow: feature branch per experiment. DVC tracks data changes. MLflow logs every metric. Automated testing in CI catches regressions. Every repository has a model card.

The moment that convinced me to change: a client asked me to reproduce results from six months earlier. I couldn't. Not because the code was lost — because I didn't know which data version and which config produced those results.

Reproducibility isn't a nice-to-have. In regulated industries, it's legally required. For everyone else, it's the foundation of trustworthy AI.

Set up proper versioning once. Save yourself hundreds of hours of ""which experiment was that?"" forever.","#Git #VersionControl #MLOps #GitHub #MachineLearning #BestPractices"
"47","AI Writing Books","Writing my third AI book taught me something I didn't expect: teaching AI is significantly harder than building AI.

When you build a system, you can rely on intuition. You make choices that ""feel right"" based on experience. When you write about it, you have to articulate WHY every choice was made. And sometimes you realize... you don't actually know why. You just did what worked.

That's humbling. And incredibly valuable.

Every ML engineer should write, even if it's just blog posts. Not for the followers or the personal brand (though those help). Because the act of explaining forces you to understand more deeply.

How I started: technical blog posts on Medium. Then tutorials on YouTube. Then I contributed to documentation for open source projects. Eventually I pitched a book to a publisher, using my blog as my portfolio.

Three published books later, here's what I know: writing about AI has made me a better engineer than any course or certification. When you can explain something clearly to a beginner, you truly understand it.

And if you can't explain it simply? That's a sign you need to study it more, not less.","#TechWriting #AIBooks #ContentCreation #PersonalBrand #KnowledgeSharing"
"48","Responsible AI","We caught a production model silently performing 15% worse for users over 55 last year.

Nobody intended it. The training data just had fewer samples from older users. The model optimized for overall accuracy and effectively deprioritized the underrepresented group.

This is the thing about AI bias — it rarely looks like intentional discrimination. It looks like optimization on unrepresentative data. It looks like a team that didn't check demographic performance breakdowns. It looks like ""the model works great"" when tested on averages but fails specific populations.

Responsible AI isn't about political correctness or slowing down innovation. It's about catching problems that cost you users, lawsuits, and trust.

Practical steps that actually work: test model performance across demographics before deployment. Monitor for drift continuously. Provide explanations for high-impact decisions. Always allow human override. Document everything.

The engineer who builds AI that's powerful AND equitable isn't checking a compliance box. They're building something that actually works for everyone.

That should be the default, not the exception.","#ResponsibleAI #AIGovernance #Fairness #Transparency #AIEthics"
"49","Transfer Learning","A client once asked me to build an image classifier for their specific product line. They had 500 labeled images.

A few years ago, I'd have said ""we need at least 50,000 images."" Instead, I took a pre-trained ResNet, fine-tuned the last few layers on their 500 images, and had a working classifier in an afternoon. 93% accuracy.

Transfer learning is so established now that training from scratch almost never makes sense. Why learn what a cat looks like when someone's already spent millions in compute teaching a model that?

The mental model is simple: start with a pre-trained model (ResNet for images, BERT for text, Whisper for audio, Llama for language tasks, CLIP for image-text). Adapt it to your specific domain with your (potentially small) dataset.

10x less data needed. 100x less compute. Often better results because you're building on robust foundations.

The most productive ML engineers in 2026 don't train models from scratch. They adapt existing ones. It's not lazy — it's smart engineering. Standing on the shoulders of giants isn't just a metaphor. It's a strategy.","#TransferLearning #PreTrainedModels #DeepLearning #FineTuning #MachineLearning"
"50","AI Daily Routine","People ask me how I stay current in a field that moves this fast. Here's the honest answer: structured daily habits.

Morning (before ""real work""): one ML paper from arxiv or Hugging Face daily papers — usually just the abstract and figures, maybe the methods section if it's relevant. Two LeetCode problems with coffee. Quick scroll through GitHub trending for interesting repos.

Work day: deep focus on building and deploying. This is the part that actually matters.

Afternoon: experiment with one new tool or framework for 30-60 minutes. Write a few paragraphs of documentation or a blog post. Some open source contribution when I can.

Evening: something not AI. Poetry, music, a walk. Seriously — creativity matters, and burnout is the fastest way to become a mediocre engineer.

This routine has produced 250+ AI systems, 3 books, and 7 research papers over the years. Not because any single day is extraordinary, but because doing small things consistently adds up to something big.

The secret isn't intensity. It's showing up every day and doing a little more than yesterday. 1% better compounds into something unrecognizable over time.","#DailyRoutine #Productivity #AIEngineer #WorkLifeBalance #MachineLearning"
"51","Feature Engineering","I once improved a model's performance by 12% without changing the model architecture, hyperparameters, or training procedure.

All I did was add three domain-specific features that a subject matter expert suggested over coffee.

Feature engineering is the unglamorous skill that wins competitions, ships products, and separates good ML engineers from great ones.

Here's what I've learned from 250+ projects: better features with a simple model beats poor features with a complex model. Every. Single. Time.

The fancy new architecture everyone's excited about on Twitter? It might give you 2% improvement. A well-crafted feature based on domain knowledge? Easily 5-15%.

In 2026, feature engineering has gotten more sophisticated with automated feature stores (Feast, Tecton), embedding features from pre-trained models, and temporal features for time-aware systems. But the core skill — understanding your domain deeply enough to create meaningful representations of your data — that's still very much a human skill.

Talk to domain experts. Understand the business. Then engineer features that encode that understanding.

That's where ML becomes art.","#FeatureEngineering #DataScience #MachineLearning #MLPipeline #AI"
"52","Autonomous Vehicles","Self-driving cars are the most complex ML system that exists. Full stop.

3D object detection fusing LiDAR and camera data. Path planning combining reinforcement learning with graph algorithms. Behavior prediction using transformers. Sensor fusion across multiple modalities. All running at less than 50ms latency because lives literally depend on it.

And then simulation testing in digital twins because you can't test edge cases — ""what happens when a ball bounces into the road from between parked cars"" — in the real world at scale.

I find this fascinating not because I work on autonomous vehicles directly, but because the engineering challenges cascade into every other field. Real-time inference constraints. Safety-critical ML. Multi-sensor fusion. Performance-critical code in C++.

If you can build systems that work for autonomous driving, you can build ML for anything.

The companies in this space (Tesla, Waymo, and several others) are hiring aggressively for ML engineers who understand 3D vision, RL, and real-time systems. It's one of the hardest ML problems. And one of the most rewarding if you want to work on technology that will genuinely reshape how the world moves.","#AutonomousVehicles #SelfDriving #ComputerVision #ReinforcementLearning #Robotics"
"53","Debugging ML","The worst bug I ever encountered: a model that ran perfectly, passed all tests, and gave completely wrong predictions in production.

No error messages. No crashes. Just confident, consistent, wrong outputs.

Took me three days to find it. The preprocessing pipeline applied normalization differently during training and inference. The model had learned to work with one distribution and was receiving another. Classic train-serve skew.

ML bugs are fundamentally different from software bugs. With software, broken code fails visibly. With ML, broken systems run fine — they just produce garbage silently.

My debugging checklist (earned through pain):
Start with the data. Always the data. Check for leakage — is future information sneaking into training? Verify preprocessing is identical in training and inference. Inspect actual predictions, not just aggregate metrics. Use learning curves to diagnose overfitting vs. underfitting. A/B test in production.

Common culprits: future data leaking in, wrong evaluation split, mismatched preprocessing, silent NaN values, corrupted labels.

Debugging is easily 50% of an ML engineer's real job. Courses spend 5% of time on it. That gap is where experience lives.","#MLDebugging #MachineLearning #SoftwareEngineering #BestPractices #ProductionML"
"54","Knowledge Graphs","Standard RAG has a dirty secret: it treats your documents as isolated chunks of text. No relationships. No structure. Just bags of words in a vector space.

That works fine until someone asks: ""Which team members worked on both Project Alpha and the Q3 budget revision?"" Now your RAG system needs to understand relationships, not just similarity.

This is where Knowledge Graphs + LLMs gets interesting.

Instead of flat document chunks, you build a graph of interconnected entities and relationships. People connected to projects. Projects connected to budgets. Budgets connected to time periods. Then you retrieve not just similar text, but connected knowledge.

Microsoft's GraphRAG proved this at scale. LlamaIndex has solid knowledge graph RAG support. Neo4j is the go-to graph database.

The practical difference I've seen: regular RAG gets you 70-80% answer quality on complex, multi-hop questions. GraphRAG gets you closer to 90%.

The implementation is harder, no question. But for enterprise use cases where accuracy on complex questions matters? Knowledge graphs are the next evolution of RAG.

And very few engineers know how to build this properly. Opportunity is sitting right there.","#KnowledgeGraphs #GraphRAG #Neo4j #LLM #AIArchitecture #MachineLearning"
"55","MLOps Tools Stack","Junior engineers always ask me: ""What tools should I learn for MLOps?""

And I always give the same frustrating answer: ""It depends.""

But let me at least give you the framework. Every production ML system needs something from each of these categories:

Experiment tracking: MLflow or Weights & Biases. Data versioning: DVC. Feature store: Feast. Model serving: FastAPI + Docker (start here) or Triton for scale. Monitoring: Evidently AI is great open source. Orchestration: Airflow or Prefect. CI/CD: GitHub Actions.

You don't need all of these on day one. Start with experiment tracking (MLflow) and containerized serving (FastAPI + Docker). Add monitoring (Evidently). Then layer in data versioning and orchestration as your system matures.

The mistake I see: teams trying to implement the full stack from the start. That's a six-month project before you've deployed a single model.

The right approach: ship a simple pipeline first. Add sophistication as you feel the pain of not having it. That pain guides your tooling choices better than any blog post.","#MLOps #ToolStack #MachineLearning #DevOps #ModelDeployment #AI"
"56","Natural Language to SQL","My non-technical CEO asked me: ""Can I just type 'show me revenue by region for Q4' and get the answer from our database?""

I built it in a week. He uses it every single day now.

Text-to-SQL might be the highest ROI AI application for most companies. Every organization has databases. Most business users can't write SQL. The bridge between ""I have a question"" and ""here's the answer"" is worth enormous money.

The architecture is straightforward: schema-aware prompting (teach the LLM your database structure), query validation (never run unvalidated SQL), error handling with retry logic, and result visualization.

LangChain has a SQL agent that handles the basics. Vanna.ai is purpose-built for this. DuckDB + LLM is a lightweight option.

The tricky parts: handling ambiguous queries (""revenue"" could mean gross or net), preventing SQL injection (always validate), and managing complex joins across many tables.

But even a basic implementation that handles 60% of queries correctly saves analysts hours daily. And in my experience, that's usually enough to get enthusiastic buy-in for further development.

Every company with a database needs this. And most haven't built it yet.","#TextToSQL #NLP #DatabaseAI #LLM #DataAnalytics #BusinessIntelligence"
"57","AI Certifications","I have 240+ certifications. Want to know how many got me a job? Maybe three.

Don't get me wrong — certifications have value. AWS ML Specialty tells employers you understand the platform. Google Cloud Professional ML Engineer is respected. NVIDIA Deep Learning Institute teaches genuinely useful skills.

But I've sat on hiring panels where candidates lead with ""I have 15 certifications"" and can't answer ""how would you deploy this model to production?""

Here's what actually matters more than certs: GitHub projects that show you can build things end-to-end. Models published on Hugging Face that others can use. Technical blog posts that demonstrate depth of understanding. Open source contributions that show you work well in codebases. Kaggle competitions that prove you can handle messy data.

My recommendation: get one or two high-value certifications (AWS ML Specialty or GCP ML Engineer) to check the box. Then invest the rest of your time in projects.

Certifications open doors. Projects close deals. Put your energy where the leverage is highest.","#Certifications #AICareer #AWS #GoogleCloud #MachineLearning #CareerAdvice"
"58","Stable Diffusion Custom","A furniture company came to me wanting product photos in 50 different room settings. Traditional approach: hire photographers, rent 50 rooms, do photoshoots. Cost estimate: $200,000+.

What we built: a fine-tuned Stable Diffusion pipeline that generates photorealistic product images in any setting. Cost: about $3,000 in development and a few dollars per batch of images. Time: two weeks.

This is the kind of application that makes generative AI genuinely transformative for businesses.

DreamBooth lets you teach the model your specific products. LoRA adds style control with minimal compute. ControlNet gives precise spatial control. Inpainting handles edits to specific regions. All trainable on a single GPU in under an hour.

The use cases multiply once you start looking: architecture visualization, game asset generation, fashion design prototyping, medical image augmentation for training data.

Companies are paying $10K-$50K for custom image generation pipelines. The tools are free and open source. The margin is excellent for anyone who invests the time to learn.

This is one of those rare situations where the technology is mature, the demand is high, and most potential builders don't realize how accessible it's become.","#StableDiffusion #GenerativeAI #AIArt #FineTuning #ComputerVision #LoRA"
"59","MLOps Interview","I failed my first MLOps interview because I could explain model drift conceptually but couldn't describe how I'd detect it in a production system with 50 microservices.

Theory vs. practice. That gap is exactly what MLOps interviews test.

The questions that come up repeatedly: How do you detect model drift in production? (Hint: statistical tests on prediction distributions, not just accuracy monitoring.) Design a CI/CD pipeline for ML models. How would you handle A/B testing for ML? How do you version datasets AND models? How to scale model serving to 10K requests per second? Design a retraining pipeline.

What separates good answers from great ones: specifics. Don't say ""I'd monitor for drift."" Say ""I'd use Evidently AI to compute PSI on prediction distributions weekly, with alerting thresholds set relative to baseline drift rates, and automatic rollback triggers.""

The pattern I've noticed: companies don't want MLOps theorists. They want people who've actually been paged at 2 AM because a model started returning garbage and had to fix it.

If you can confidently walk through real production scenarios — including the messy parts — you'll stand out.","#MLOps #TechInterview #MachineLearning #InterviewTips #DevOps #AIJobs"
"60","Recommendation Systems","Recommendation systems reportedly drive 35% of Amazon's revenue. Netflix says 80% of watched content comes from recommendations.

Yet most ML engineers have never built one from scratch.

The architecture has evolved dramatically. The modern approach uses a two-tower model: one tower embeds users, another embeds items. A retrieval stage quickly narrows millions of candidates to hundreds. A ranking stage carefully orders those hundreds. Then business rules apply on top.

What's new in 2026: transformer-based sequential recommendation (modeling the sequence of your interactions, not just individual preferences), multi-objective optimization (balance engagement, revenue, AND user satisfaction), and LLM-powered recommendation where language models reason about why you might like something.

The fascinating challenge is that recommendations face a tension most ML systems don't: the model's predictions change user behavior, which changes the data, which changes the model. It's a feedback loop that can spiral into filter bubbles if you're not careful.

If you want to understand the intersection of ML, product thinking, and business impact — build a recommendation system. There's no better training ground.","#RecommendationSystems #RecSys #Personalization #MachineLearning #DeepLearning"
"61","Small Language Models","Controversial take: most production systems don't need GPT-4 class models.

I replaced a GPT-4 API call with a fine-tuned 3B parameter model for a client's customer categorization task. Same accuracy. Cost went from $400/day to $12/day. Latency dropped by 80%.

Small Language Models (1B-7B parameters) are having a moment for good reason. Phi-3, Gemma 2, Qwen 2.5, Llama 3.2 — these aren't ""lesser"" models. They're right-sized for specific tasks.

The math is simple: if your use case is well-defined (classification, extraction, formatting, domain-specific Q&A), a well-tuned small model often matches a general-purpose giant model. But it runs on consumer hardware, costs pennies to operate, and responds in milliseconds.

Smart engineering isn't about using the biggest model. It's about using the right-sized model.

Start with the smallest model that could possibly work. Scale up only if it doesn't. This saves money, improves latency, and often forces you to think more carefully about your problem definition — which leads to better solutions anyway.

The best model isn't the biggest. It's the one that solves your problem at the lowest cost.","#SLM #SmallLanguageModels #LLM #ModelOptimization #AIEngineering #CostEfficiency"
"62","Data-Centric AI","I spent two weeks tuning hyperparameters on a client project. Improved performance by 0.3%.

Then I spent two days fixing label errors in the training data. Performance jumped 4.2%.

Andrew Ng has been preaching data-centric AI for years. Having built 250+ systems, I can confirm: he's right.

The instinct when a model underperforms is to try a fancier architecture, tune more hyperparameters, or add more layers. But in 90% of my projects, the answer was simpler: fix the data.

Before touching any model configuration, I now check: are there label errors? (There always are.) Is there class imbalance? (There usually is.) Are there duplicates inflating metrics? (More often than you'd think.) What does the data distribution actually look like?

This isn't exciting work. Nobody tweets about spending a week on data cleaning. But it's the highest-leverage activity in most ML projects.

Better data with a simple model beats mediocre data with a complex model. I've seen this pattern so many times I've stopped being surprised by it.

Fix the data first. Always.","#DataCentricAI #DataQuality #MachineLearning #DataScience #MLBestPractices"
"63","AI for Indian Market","Working at ISRO, I see firsthand something that most global tech discourse misses: India isn't just consuming AI. India is building it.

The opportunities here are massive and unique. Indic language NLP — building models that work in Hindi, Tamil, Marathi, Bengali, and dozens of other languages with hundreds of millions of speakers. AI for agriculture in a country where farming is the largest employer. Healthcare AI for rural areas where doctors are scarce. EdTech personalization for a country with the world's largest student population.

The government is pushing with IndiaAI. The startup ecosystem is booming. And there's a fundamental cost advantage for AI services.

What makes India's AI trajectory different: scale. Every problem here involves hundreds of millions of users. The models, infrastructure, and engineering approaches that work at Indian scale are world-class by definition.

Bengaluru, Hyderabad, Chennai — these aren't ""emerging"" AI hubs anymore. They're established ones. The talent density, the startup ecosystem, the institutional investment — it's all here.

The next decade of AI won't be built only in Silicon Valley. A lot of it will be built here.","#IndiaAI #MakeInIndia #StartupIndia #ArtificialIntelligence #TechIndia"
"64","Monitoring ML Models","A model I deployed for a client started giving increasingly weird predictions. Nobody noticed for six weeks.

By the time they flagged it, the model had been confidently making bad decisions for 10,000+ transactions. The input data had shifted gradually — a supplier changed their data format — and the model's performance degraded slowly enough that no one caught it.

That experience made me obsessive about monitoring.

ML models degrade silently. Unlike traditional software that crashes visibly, a deteriorating model keeps running, keeps serving predictions, and keeps looking fine on the surface. The only way to catch problems is active monitoring.

What I track now: prediction distribution shift (are outputs changing?), feature drift (are inputs changing?), performance metrics with real labels when available, latency and throughput, error rates on edge cases.

Evidently AI is excellent open source tooling for this. Whylabs for data profiling. Grafana + Prometheus for infrastructure. Custom Streamlit dashboards for business stakeholders.

The rule I follow: if you can't see it degrading, you can't fix it before users suffer. Deploy monitoring with the same urgency as the model itself.","#MLMonitoring #ModelDrift #MLOps #Observability #MachineLearning #Production"
"65","Quantum ML","Honest take on Quantum Machine Learning in 2026: it's mostly still research. And that's okay.

There are specific areas where quantum advantages are real — molecular simulation, certain optimization problems, quantum-enhanced feature spaces. But for most practical ML tasks today, classical computing is faster, cheaper, and more reliable.

I've explored Qiskit, Cirq, and PennyLane enough to understand the landscape. The technology is genuinely fascinating and the theoretical potential is real.

But I wouldn't advise anyone to bet their career on quantum ML right now. Not yet.

What I WOULD suggest: learn the basics. Understand why quantum parallelism matters for certain problem classes. Get comfortable with the concepts. Because when quantum computers scale (my guess: 2028-2030 for practical ML applications), the engineers who understand both ML and quantum computing will be extraordinarily rare and valuable.

It's like learning about deep learning in 2010. Impractical then, but the people who invested early became leaders when the hardware caught up.

Place a small bet. Keep most of your chips on classical ML. But know what's coming.","#QuantumComputing #QuantumML #MachineLearning #FutureTech #Research"
