"post_number","category","post_text","hashtags"
"66","LLM Evaluation","We shipped an LLM-powered feature last year with no evaluation framework. ""It looks good in testing"" was our quality bar.

Within two weeks, users found that it hallucinated medical advice, gave different answers to the same question depending on phrasing, and sometimes just... made up citations.

Never again.

LLM evaluation is now the first thing I set up, not the last. Before writing application logic, I build the evaluation pipeline.

What to measure: factuality (is it making stuff up?), relevance (does it answer the actual question?), coherence (does the response make sense?), safety (will it say something harmful?), and instruction following (does it do what was asked?).

The tools have gotten quite good. DeepEval for comprehensive evaluation. RAGAS specifically for RAG systems. Promptfoo for systematic prompt testing. LangSmith for monitoring in production.

Three approaches, each with tradeoffs: automated metrics (fast but shallow), LLM-as-Judge where another LLM evaluates outputs (decent balance), and human evaluation (gold standard but expensive and slow).

You wouldn't ship code without tests. Shipping LLMs without evaluation is the same mistake — just with more creative failure modes.","#LLMEvaluation #Testing #GenerativeAI #QualityAssurance #AIEngineering"
"67","Open Source Contribution","Contributing to open source genuinely changed the trajectory of my career. Not because of some grand contribution — because of a typo fix.

My first open source PR was fixing a typo in the README of a popular ML library. Tiny change. But it got me comfortable with the contribution process, and I started doing more: adding tests, fixing small bugs, then eventually contributing features.

With 176+ repos and 8 PyPI packages, here's what I know for sure: open source contributions on your GitHub profile carry more weight than almost anything else in ML hiring.

It shows you can navigate large codebases (most ML engineers can't). It shows you write code that meets real quality standards. It shows you collaborate with other engineers. And it's publicly verifiable — no way to fake it.

Where to start: Hugging Face Transformers has great ""good first issue"" labels. LangChain is rapidly growing and welcomes contributors. scikit-learn is beginner-friendly. FastAPI has a clean codebase.

Start small. Fix a typo. Add a test case. Update documentation. Then work your way up to features.

The first PR is the hardest. After that, it becomes addictive.","#OpenSource #GitHub #Programming #MachineLearning #Community #CareerGrowth"
"68","Streaming ML","A bank I worked with was detecting fraud in daily batches. They'd process the previous day's transactions every morning.

The problem: by the time they flagged a fraudulent transaction, the money was already gone. They were always 24 hours behind the criminals.

We rebuilt it as a streaming ML pipeline. Kafka for event streaming, Flink for real-time processing, Redis for feature caching, and the model served via FastAPI with WebSocket connections.

Time to detection went from 24 hours to under 50 milliseconds. The amount of prevented fraud in the first quarter alone justified the entire project cost.

This is the difference between batch ML and real-time ML. For some applications, yesterday's predictions are useless.

Streaming ML applies everywhere: dynamic pricing, live recommendation updates, IoT anomaly detection, social media trend analysis. If the real world is moving in real-time, your model should too.

The stack is more complex than batch processing, no question. But the value proposition is often so clear that it sells itself.

If your model only sees yesterday's data, you're already late.","#StreamingML #RealTimeAI #ApacheKafka #DataStreaming #MachineLearning"
"69","Building AI Teams","The smartest AI team I ever worked with shipped nothing for 18 months.

Four PhDs. Brilliant researchers. Could discuss the latest papers for hours. Could not deploy a model to save their lives.

Meanwhile, a team down the hall — an ML engineer, a data engineer, an MLOps engineer, and a product manager — shipped three products in the same period.

The difference wasn't intelligence. It was balance.

The minimum viable AI team I'd build: one ML engineer (builds models), one data engineer (builds reliable pipelines), one MLOps engineer (deploys and monitors), and one product manager (defines the right problems to solve). That's four people who can go from idea to production.

The most common mistakes I see in AI team building: all researchers with no engineers, no MLOps consideration from day one, no clear problem statement (just ""do AI stuff""), and chasing state-of-the-art instead of solving business problems.

The best AI team isn't the smartest one. It's the most balanced one — with a clear problem to solve and the complementary skills to solve it end-to-end.","#AITeam #TeamBuilding #TechLeadership #MachineLearning #Engineering #Management"
"70","Embeddings Deep Dive","If someone asked me ""what's the single most important concept in modern AI?"" I'd say embeddings without hesitating.

Everything in modern AI gets converted to vectors. Words, images, audio, code, users, products — all represented as points in high-dimensional space where similarity equals proximity.

This is the universal language of AI. When a search engine finds relevant documents, it's comparing embedding vectors. When Netflix recommends a movie, it's finding nearby vectors. When your phone clusters similar photos, it's grouping close vectors.

The models keep getting better. OpenAI's text-embedding-3-large. BGE models from BAAI. Cohere's embed v3. CLIP for joint text-image space. Sentence-Transformers for efficient encoding.

But the concept is what matters: once you internalize that ""similar things have similar vectors,"" you see applications everywhere. Classification becomes: which cluster is this vector nearest to? Search becomes: find the nearest vectors. Anomaly detection becomes: find vectors far from everything.

Understanding embeddings deeply — not just calling an API, but understanding the geometry, the training objectives, the failure modes — is the foundational skill that makes everything else in modern AI click.

Master embeddings and the rest follows.","#Embeddings #VectorSearch #DeepLearning #NLP #MachineLearning #AIFundamentals"
"71","AI Freelancing","I've delivered 250+ AI systems to clients worldwide. Here's the part about AI freelancing nobody tells you: the technical work is maybe 40% of the job.

The other 60%? Understanding the client's actual problem (which is usually different from what they initially describe), managing expectations, communicating progress in non-technical language, and navigating scope changes.

The market for AI freelancing in 2026 is strong. RAG chatbot development runs $5K-$25K per project. Fine-tuned LLMs for business: $10K-$50K. Computer vision systems: $8K-$30K. ML pipeline automation: $5K-$20K. Consulting rates of $200-$500/hr for experienced engineers.

My approach that's worked consistently: understand the problem before talking about technology. Propose the simplest solution that could work. Deliver a working MVP fast. Iterate based on feedback.

The clients who become repeat customers are the ones where I said ""you actually don't need AI for this, a simple rules engine would work"" when that was true. Trust is built by NOT selling unnecessary complexity.

Freelancing in AI is very much alive. But treating it as a business — not just a technical exercise — is what makes it sustainable.","#AIFreelancing #Freelancer #MachineLearning #Consulting #RemoteWork"
"72","Anomaly Detection","Anomaly detection is the least glamorous ML application and possibly the most valuable.

Nobody writes excited LinkedIn posts about it. But it's silently saving millions of dollars every day — catching fraudulent transactions, predicting equipment failures before they happen, detecting network intrusions, flagging quality issues on production lines.

The fundamental challenge: anomalies are, by definition, rare. You can't just train a standard classifier because you barely have any positive examples. This is why unsupervised and semi-supervised approaches dominate — Isolation Forest, autoencoders, one-class SVM, statistical process control.

What makes anomaly detection interesting as an engineering problem is that ""normal"" keeps changing. Seasonal patterns, business growth, new products, changing user behavior — your definition of ""anomalous"" has to evolve continuously.

I've built anomaly detection systems for banking (fraud), manufacturing (defects), and healthcare (patient monitoring). The domain knowledge required is completely different each time, but the engineering patterns are surprisingly similar.

If you're looking for ML work that has clear, measurable business impact and will always be in demand — anomaly detection won't make you famous on Twitter, but it'll make you indispensable to your company.","#AnomalyDetection #FraudDetection #MachineLearning #DataScience #AI"
"73","Technical Debt in ML","There's a famous paper from Google called ""Machine Learning: The High Interest Credit Card of Technical Debt."" It was published in 2015 and somehow it's even more relevant in 2026.

ML technical debt is worse than software technical debt because it's invisible. Your model doesn't throw errors — it just quietly gets worse. Your features become entangled in ways nobody understands. Your data dependencies are undocumented. Your pipeline is a jungle of ad-hoc scripts that only one person (who left six months ago) understood.

I've inherited ML projects that looked clean on the surface and were absolute disasters underneath. Stale models nobody updated. Features computed differently in training vs. serving. No monitoring. No documentation. No tests.

How I manage it now: documentation for every model (not optional — required). Automated tests for data quality. Regular model audits (quarterly minimum). Clean, modular feature engineering pipelines. Proactive sunsetting of unused models.

The rule I enforce on my teams: 20% of every sprint goes to paying down technical debt. It feels expensive until you compare it to the cost of a production outage caused by a model nobody understood.

Technical debt kills ML projects slowly. Pay it down consistently or it will bankrupt you all at once.","#TechnicalDebt #MLOps #SoftwareEngineering #MachineLearning #BestPractices"
"74","AI + IoT","There will be 50 billion IoT devices by 2030. That's 50 billion things generating data that needs intelligence.

AI + IoT is the convergence that doesn't get enough attention because it's not as photogenic as chatbots. But it's arguably more impactful.

Smart factories with predictive maintenance that catches equipment failure days before it happens. Agricultural sensors combined with weather ML models that tell farmers exactly when and how much to irrigate. Health monitors that detect cardiac anomalies and alert doctors before patients feel symptoms.

The technical stack is surprisingly accessible: edge devices (Raspberry Pi, Jetson Nano), MQTT or Kafka for data streaming, TensorFlow Lite or ONNX for on-device inference, time series models for prediction, and cloud for periodic retraining.

What makes this field interesting is the constraint engineering. You're deploying models on devices with limited memory, limited compute, limited battery. You can't just throw a bigger GPU at the problem. You have to be genuinely clever about efficiency.

If you enjoy the puzzle of making powerful models run in resource-constrained environments, AIoT is deeply satisfying work. And the demand is growing faster than any other AI subdomain I track.","#AIoT #IoT #EdgeComputing #SmartCity #MachineLearning #Industry40"
"75","Startup Ideas in AI","10 AI startup ideas that are technically feasible today with existing tools but most people haven't built yet:

An AI legal contract analyzer that flags risky clauses and suggests alternatives. A personalized AI tutor that adapts to each student's learning pace and style. Real-time translation earbuds that handle accents and colloquialisms. AI inventory management for small businesses that can't afford enterprise software. Automated medical report generation from doctor-patient conversations. An AI-driven recruitment tool that evaluates skills, not resumes. Predictive maintenance as a service for small manufacturers. A no-code custom AI chatbot builder for non-technical business owners. An AI food waste reduction platform for restaurants. Autonomous drone inspection for infrastructure (bridges, power lines, solar farms).

Every single one of these can be built with open source models, existing APIs, and standard cloud infrastructure.

The gap isn't technology. It's execution, distribution, and deep understanding of the customer problem.

Which one would you build? I'm genuinely curious.","#AIStartup #Entrepreneurship #StartupIdeas #ArtificialIntelligence #Innovation"
"76","XGBoost Still Wins","I proposed a deep learning solution for a tabular data problem last year. My colleague suggested XGBoost.

XGBoost won. By a meaningful margin. Trained in minutes instead of hours. Required no GPU. Was more interpretable. Used a fraction of the data.

This happens more often than the deep learning hype would have you believe.

For tabular data — and that's what most business data IS — gradient boosted trees (XGBoost, LightGBM, CatBoost) are still king in 2026. Not always, but more often than not. They're faster to train, need less data, are more interpretable, and don't require expensive hardware.

Deep learning shines on images, text, audio, and sequences. For structured business data in rows and columns? Often overkill.

The best ML engineer uses the right tool, not the fanciest one. Sometimes that's a 175B parameter transformer. Sometimes it's a gradient boosted tree you can train on your laptop during lunch.

There's no shame in simple solutions that work. In fact, there's significant wisdom in reaching for them first.

The measure of engineering skill isn't complexity. It's effectiveness.","#XGBoost #GradientBoosting #TabularData #MachineLearning #PracticalML"
"77","AI for Education","I teach AI at Tutorials Point. The irony of teaching a subject that's reshaping education itself isn't lost on me.

What I've observed: AI in education works best when it amplifies teachers, not replaces them. The best applications aren't ""AI teacher"" — they're ""AI teaching assistant.""

Adaptive learning paths that identify where a student is struggling and adjust difficulty. Real-time feedback on essays that catches structural issues before a teacher reads it. Intelligent tutoring that provides patient, infinitely available practice. Student performance prediction that flags at-risk students early enough to intervene.

The technology for all of this exists today. An LLM with good RAG over course material can create a personalized tutor in an afternoon.

But what I've learned from teaching is that the human element matters enormously. The moment of encouragement when someone gets stuck. Reading body language to know when to push harder or ease off. The mentorship that shapes how someone thinks, not just what they know.

AI handles the ""what."" Teachers handle the ""why"" and the ""who cares.""

The next billion-dollar EdTech company will nail this balance. All the technology, with all the humanity.","#EdTech #AIinEducation #PersonalizedLearning #Teaching #Innovation"
"78","Attention Mechanism","If you can't explain the attention mechanism, you don't truly understand modern AI. Strong statement, but I stand by it.

Here's how I explain it to someone new: imagine you're reading a long document and someone asks a question. You don't re-read the entire document equally. You ATTEND to the relevant parts — your eyes jump to specific sentences that matter for that question.

That's attention. Mechanically, it works through Query, Key, and Value matrices. The Query asks ""what am I looking for?"" The Keys say ""here's what each position contains."" The dot product between them gives attention weights — how much to focus on each position. Then those weights select from the Values.

Multi-head attention runs this process multiple times in parallel, each head learning to attend to different types of relationships.

This powers literally everything: GPT, Claude, Llama, BERT, Gemini. All built on this mechanism.

And the variants keep evolving. Flash Attention saves memory. Grouped Query Attention speeds up inference. Sliding Window Attention handles longer contexts. Cross Attention connects different modalities.

Implementing a transformer from scratch — actually coding the attention computation — was the weekend that changed my understanding of AI more than any course.","#AttentionMechanism #Transformers #DeepLearning #NeuralNetworks #LLM"
"79","AI Certifications Roadmap","People ask for my certification roadmap. Here's what I'd do if I were starting fresh in 2026, based on 240+ certifications and the perspective of knowing which ones actually mattered.

Months 1-2 (Foundation): Andrew Ng's ML Specialization and Google's ML Crash Course (both free). Build two small projects.

Months 3-4 (Cloud): Pick ONE — AWS ML Specialty OR GCP ML Engineer. Not both. Build a project on that cloud platform.

Months 5-6 (GenAI): NVIDIA Deep Learning courses and DeepLearning.AI's GenAI specialization. Build a RAG application.

Months 7-8 (MLOps): Databricks ML Professional. Learn Docker and basic Kubernetes. Deploy one of your previous projects properly.

Months 9-12 (Specialization): Go deep in a domain — healthcare, finance, computer vision, whatever excites you. Read and implement papers.

The critical rule: every certification should produce a project. If you can't build something with what you learned, the certification was wasted time.

Don't collect certificates. Accumulate capabilities. The certificate goes on LinkedIn. The project goes on GitHub. Guess which one gets you hired.","#Certifications #LearningPath #AIEngineer #CareerRoadmap #MachineLearning"
"80","LLM Memory","LLMs have the memory of a goldfish. Every conversation starts from zero. They don't remember you, your preferences, or what you discussed yesterday.

This is one of the most important unsolved problems in AI, and solving it (even partially) is enormously valuable.

The approaches that work in practice: RAG for external knowledge (the model retrieves relevant context). Conversation buffers for short-term memory (keeping recent messages). Summary memory that compresses long histories into concise recaps. Entity memory that tracks specific people, projects, and things mentioned. Long-term vector storage that embeds and retrieves past conversations.

More sophisticated approaches are emerging. MemGPT lets the model manage its own memory like an operating system. Zep provides long-term memory as a service. LangGraph checkpointing saves agent state.

The chatbot that remembers your name, your preferences, your past conversations — that's not magic. That's careful memory engineering. And the difference in user experience is dramatic.

I've built chat systems with and without memory. The ones with memory have 3-4x higher user retention. People don't want to re-explain themselves every time.

If you want an impactful project, build a chat application with genuine long-term memory. It's harder than it looks and more rewarding than you'd expect.","#LLMMemory #ChatbotDevelopment #GenerativeAI #LangChain #AIArchitecture"
"81","Soft Skills for AI","Hard truth from a decade in AI: the projects that succeeded weren't the ones with the best models. They were the ones with the clearest communication.

I've worked with Mercedes-Benz Germany, the Indian Army, IIT Bombay, and dozens of other organizations. The technical challenges were real. But the projects that stalled? Almost always a communication problem.

Stakeholders who didn't understand what the model could and couldn't do. Engineers who couldn't translate ""precision-recall tradeoff"" into business terms. Teams where nobody documented decisions.

The ML engineer who can explain gradient descent to a CEO using a simple analogy? That's the one who gets promoted. The one who writes documentation so clear that a new team member can onboard in days? Indispensable. The one who can sit in a meeting and say ""I hear your concern. Here's what the model does in that scenario, and here's our mitigation plan""? That's leadership.

I know ""soft skills"" sounds like vague advice. So let me be specific: practice explaining technical concepts to non-technical people. Write clear documentation. Learn to manage stakeholder expectations. Present your work with confidence.

These skills compound more than any technical skill I've developed.","#SoftSkills #Communication #TechLeadership #AIEngineer #CareerGrowth"
"82","Serving LLMs","Here's a statistic that should make AI startup founders nervous: serving costs kill more AI companies than bad models.

Training an LLM is a one-time cost. Serving it to thousands of users 24/7 is an ongoing hemorrhage if you're not careful.

I've seen startups spending $100/day on inference that could cost $5 with proper optimization. The difference is entirely infrastructure engineering.

The serving stack has gotten much better. vLLM with PagedAttention is the fastest open source option. Hugging Face TGI is solid. NVIDIA's Triton for maximum performance. Ollama for local deployment. LiteLLM as a proxy for multiple providers.

The optimization techniques that actually save money: continuous batching (serve multiple requests simultaneously), KV-cache management (don't recompute what you've already computed), quantization (INT4/INT8 for inference), speculative decoding (predict multiple tokens at once), and prefix caching (share computation across similar prompts).

Each of these independently can cut costs 30-60%. Combined, you're looking at 10-20x cost reduction.

The irony: most ""AI engineer"" job postings focus on model building. But the engineers who understand serving infrastructure are the ones saving companies from bankruptcy.","#LLMServing #Inference #vLLM #ModelDeployment #AIInfrastructure"
"83","AI Side Projects","Every significant career opportunity I've had came from a side project. Not a resume. Not a certification. A project.

The personal AI assistant I built for myself led to a client conversation. The code review bot I made as a weekend experiment turned into a consulting gig. A recipe generator I built to learn multimodal AI became a portfolio piece that impressed an interviewer.

Side project ideas for 2026 if you need inspiration: a personal AI assistant with actual memory across conversations, a code review bot that understands your team's conventions, an AI-powered resume analyzer, a YouTube video summarizer, a recipe generator from photos of your fridge contents.

More ambitious: a multi-agent research assistant, an AI-powered ""second brain"" that connects your notes with RAG, a real-time language translator, an AI fitness coach with pose estimation.

The key is building for yourself first. When you're the user, you care about quality in a way that tutorial projects never motivate.

Every side project teaches different skills and every one is a portfolio piece. The best learning happens when you're solving your own problems.

What's your next side project? Build it this weekend. Seriously.","#SideProjects #BuildInPublic #AIProjects #MachineLearning #WeekendProject"
"84","DeepSeek Impact","DeepSeek proved something that a lot of well-funded AI labs didn't want to hear: you don't need a trillion dollars to build excellent AI.

Their efficient architecture choices delivered competitive performance at a fraction of the compute budget of Western labs. That's not just a technical achievement — it's a strategic disruption.

What this means for engineers: study their architecture decisions carefully. They made deliberate tradeoffs that challenge assumptions about scaling laws. The lesson isn't just ""China is competitive in AI"" (though that's true). It's that clever engineering can substitute for brute-force compute.

This should be liberating for anyone who doesn't work at a company with unlimited GPU budgets. If DeepSeek can compete with models trained on 10x their resources, efficiency and architectural innovation matter more than raw spending.

The AI race isn't just US vs China. It's ideas vs resources. And sometimes, the better ideas win.

For anyone building AI: don't assume you need Google-scale infrastructure. Start with efficient architectures, smart training strategies, and creative problem-solving. The tools are available. The techniques are published. The only limit is imagination and execution.","#DeepSeek #OpenSourceAI #AIResearch #Innovation #GlobalAI #Efficiency"
