"post_number","category","post_text","hashtags"
"25","FastAPI + ML","If you're still serving ML models with Flask in 2026, we need to talk.

I migrated a client's model serving from Flask to FastAPI last quarter. Same model, same hardware. Results: 3x more concurrent requests handled, auto-generated API docs that the frontend team actually used, and type validation that caught malformed inputs before they hit the model.

FastAPI wins for ML because it's async by default (critical when your model takes 200ms per prediction and you've got hundreds of concurrent users), validates inputs with Pydantic (no more debugging why the model crashed on unexpected input), and generates interactive API docs automatically.

The basic pattern is dead simple: load model at startup, define a prediction endpoint, validate input with Pydantic, return JSON. Add a health check endpoint. Done.

Flask was great. It served us well. But FastAPI was designed for exactly this kind of workload, and the difference shows in production.

If you know Flask, the switch takes about a day. Your infrastructure team will thank you.","#FastAPI #Python #ModelServing #MachineLearning #API #Backend"
"26","AI Bubble Reality","People keep asking me: ""Is AI a bubble?""

Honest answer: parts of it, probably yes. But AI itself? No.

The parallels to the dot-com era are real. Insane valuations for companies with no revenue. ""AI-powered"" slapped on products that are basically if-else statements. Money pouring into infrastructure that may never see returns.

But here's the key difference I keep coming back to: Amazon survived the dot-com crash. Google survived. The companies building real products with real revenue survived.

OpenAI did $13B+ in revenue in 2025. That's not hype — it's a business. Companies are measurably more productive with AI tools. Developers are coding faster. Customer service costs are dropping.

Some companies will absolutely fail. The ones selling AI snake oil, the ones burning cash without a path to revenue, the wrappers with no moat.

But the engineers who build real products that solve real problems? They'll thrive regardless of what happens to the hype cycle.

Focus on value creation. Let the market sort out the rest.","#AIBubble #TechIndustry #ArtificialIntelligence #StartupLife #Innovation"
"27","NLP in 2026","When I started in NLP, the exciting project was sentiment analysis — figuring out if a review was positive or negative.

That's a homework assignment now.

NLP in 2026 is building conversational AI that remembers your previous conversations. It's systems that read a 200-page legal contract and flag problematic clauses in seconds. Cross-lingual translation that preserves tone and cultural context. Voice-to-action pipelines where you say ""schedule a meeting with the design team next Tuesday"" and it actually happens.

The stack has shifted dramatically — from spaCy to BERT to LLMs to RAG to Agents. But here's what I tell every junior engineer: the fundamentals still matter desperately. Tokenization, embeddings, attention mechanisms, NER, information extraction.

I see engineers jumping straight to LLM APIs without understanding why a model tokenizes ""unhappiness"" as [""un"", ""happiness""] instead of [""unhappy"", ""ness""]. And then they're confused when their system behaves unexpectedly.

The hype changes every year. The fundamentals haven't changed in a decade. Learn both.","#NLP #NaturalLanguageProcessing #LLM #DeepLearning #AIEngineering"
"28","Docker for ML","""But it works on my machine!""

If I had a rupee for every time I heard this during model deployment, I'd retire.

Docker solved this problem for software engineering a decade ago. Yet I still see ML engineers in 2026 shipping models as loose Python scripts with a requirements.txt that hasn't been updated in months.

Here's my standard Docker pattern for ML: start with python:3.11-slim (not the full image — you don't need gcc in production). Install dependencies. Copy model artifacts. Expose a FastAPI endpoint. Add a health check. Done.

Multi-stage builds cut your image size by 60%. GPU support with nvidia-docker works out of the box. Docker Compose handles the cases where your model needs a vector database and a cache running alongside it.

Containerization is genuinely table stakes now. Not knowing Docker as an ML engineer in 2026 is like not knowing Git in 2015.

The good news: it's a weekend of learning that pays dividends for years.","#Docker #Containerization #MLOps #DevOps #MachineLearning #Deployment"
"29","Generative AI Business","The CTO of a mid-size company told me something interesting last month:

""I don't care about your model's F1 score. Tell me how it saves us money.""

That conversation changed how I pitch AI projects.

Engineers love talking about architectures and benchmarks. Business leaders want to know: how much time does it save? What's the ROI? When does it pay for itself?

The generative AI use cases that are actually making money right now: code generation (GitHub Copilot reportedly saves 55% developer time), customer support automation, document summarization at scale, and content personalization.

Companies are projected to spend over $100B on GenAI by 2026. But the money goes to people who can connect the technology to business outcomes.

If you can walk into a room and say ""this RAG system will reduce our support ticket resolution time by 40%, saving approximately $2M annually"" instead of ""this RAG system uses a hybrid search approach with cross-encoder re-ranking"" — you're not just an engineer anymore. You're the person who gets budget approved.

Learn to speak business. It's the highest-leverage skill nobody teaches in CS programs.","#GenerativeAI #BusinessAI #Enterprise #AIStrategy #Innovation"
"30","Time Series ML","Time series is the most underrated specialization in ML and I will die on this hill.

Think about how much of the world is sequential data: stock prices, server metrics, patient vitals, weather patterns, energy consumption, IoT sensor readings, factory equipment telemetry.

Yet when I ask ML engineers what they specialize in, it's always NLP or computer vision. Almost nobody says time series.

That supply-demand mismatch means time series specialists get hired fast and paid well.

The tooling has gotten incredible too. Google's TimesFM is a foundation model for time series — essentially ""GPT for sequential data."" TSMixer applies transformer ideas. NeuralProphet extends Prophet with deep learning. PatchTST takes a clever patch-based approach.

If you're looking for a specialization that's in high demand, has low competition, and applies to virtually every industry — time series forecasting is sitting right there waiting for you.

I genuinely don't understand why more people aren't jumping on this.","#TimeSeries #Forecasting #DataScience #MachineLearning #IoT #DeepLearning"
"31","AI Salary Guide","Let's talk about AI salaries honestly, because there's a lot of misinformation out there.

In India right now — entry level (0-2 years) for AI/ML roles: 8-15 LPA. Mid level (2-5 years): 15-35 LPA. Senior (5-8 years): 35-60 LPA. Lead/Principal: 60 LPA to 1 Cr+.

Globally, US ML engineers range from $130K-$220K. Europe: €80K-€150K. Remote international roles: $100K-$180K.

But here's what the salary threads always miss: these numbers follow VALUE, not years of experience and definitely not certificates.

The highest-paid specializations I'm seeing: LLM/GenAI engineering, ML platform/infrastructure, AI security, and autonomous systems.

I've seen 3-year experience engineers making more than 8-year veterans because they deeply understand LLM deployment at scale and the veteran is still doing basic sklearn projects.

Salary is a lagging indicator of the problems you can solve. Get really good at solving expensive problems, and the compensation follows.

Nobody ever got a raise by collecting another certificate.","#AISalary #TechSalary #CareerGrowth #MachineLearning #AIJobs #India"
"32","Reinforcement Learning","Here's something most people don't realize: every time you use ChatGPT, you're using reinforcement learning.

RLHF — Reinforcement Learning from Human Feedback — is what makes LLMs actually helpful instead of just statistically completing text. It's RL that transforms a base model into something that follows instructions, refuses harmful requests, and gives useful answers.

And RL is having a moment beyond LLMs too. Robotics companies are using it for dexterous manipulation. Trading firms use it for strategy optimization. Drug discovery teams use it to explore molecular spaces.

The field went through a ""trough of disillusionment"" after the initial AlphaGo hype. But now it's quietly powering some of the most important systems in AI.

The catch: RL is genuinely hard. The concepts (PPO, policy gradients, reward shaping) are less intuitive than supervised learning. Training is unstable. Debugging is painful.

But that difficulty is exactly why RL engineers are rare and valuable. If you have the appetite for a steep learning curve with a big payoff, RL is wide open.","#ReinforcementLearning #RLHF #Robotics #DeepLearning #MachineLearning"
"33","Building Portfolio","I review AI portfolios when we hire. Here's what makes me instantly interested vs. instantly bored.

Instantly bored: Titanic survival prediction. MNIST digit classifier. Any project where the first Google result is a step-by-step tutorial.

Instantly interested: something original that solves a real problem. Doesn't have to be world-changing. A RAG chatbot over your university's course catalog. A computer vision system that identifies your houseplant diseases. A fine-tuned model that writes in your company's brand voice.

If I could design the ideal 2026 AI portfolio, it would have five projects: an end-to-end ML pipeline (data to deployment to monitoring), a RAG application, a computer vision project, a fine-tuned LLM on Hugging Face, and an AI agent that handles multi-step tasks.

But more important than what you build is HOW you present it. Clean code. A README with an architecture diagram. A deployed demo or API. A blog post explaining your design decisions and what you'd do differently.

Five quality projects with clear documentation beats fifty tutorial follow-alongs every single time.","#Portfolio #AIProjects #GitHub #CareerAdvice #MachineLearning #ShowYourWork"
"34","Federated Learning","What if you could train an AI model across 50 hospitals without any patient data ever leaving those hospitals?

That's federated learning. And it's one of the most underappreciated technologies in AI.

The idea is elegant: instead of bringing data to the model, you bring the model to the data. Each hospital trains the model locally on their own data. Only the model updates (gradients) are shared back to a central server that combines the learning.

No patient records transferred. No privacy violations. But you still get a model trained on diverse, large-scale medical data.

Google already uses this for Gboard (your keyboard learns from your typing without sending your messages). Apple uses it for Siri improvements.

In healthcare and finance — industries swimming in sensitive data they can't share — federated learning is becoming essential.

It's still relatively early. The tools (PySyft, Flower, TensorFlow Federated) are maturing but not yet mainstream. Which means if you invest time learning this now, you're ahead of the curve.

Privacy and AI don't have to be enemies. Federated learning proves that.","#FederatedLearning #PrivacyAI #DataPrivacy #MachineLearning #HealthcareAI"
"35","AutoML","A junior engineer on my team asked me nervously: ""Will AutoML make my job obsolete?""

I laughed. Not at them — at the question, because I asked the same thing five years ago.

Here's what actually happened: AutoML made me 10x faster, not 10x less valuable.

AutoGluon, Auto-sklearn, H2O — they're brilliant at the tedious parts. Feature selection. Hyperparameter tuning. Trying 50 model configurations so you don't have to.

But they can't frame the business problem. They can't decide if ML is even the right solution. They can't design the system architecture. They can't evaluate whether the model is fair. They can't explain to stakeholders why the model makes certain predictions.

Smart engineers use AutoML for the boring stuff and spend their freed-up time on problem framing, data quality, architecture decisions, and business alignment.

That's not being replaced. That's being upgraded.

Automate the automatable. Think about the thinkable. That's the whole game.","#AutoML #MachineLearning #DataScience #Automation #Productivity"
"36","Graph Neural Networks","Most of the world's data isn't rows and columns. It's relationships.

Social networks. Molecular structures. Supply chains. Financial transactions. Knowledge graphs. All fundamentally graph-structured.

And yet, when I mention Graph Neural Networks at meetups, most ML engineers give me a blank look. This is the least saturated deep learning specialization I know of.

GNNs are doing genuinely interesting work: predicting molecular properties for drug discovery, detecting fraud rings in financial networks, powering recommendation systems at scale, and enhancing RAG with knowledge graphs.

The architectures (GCN, GAT, GraphSAGE) are well-established. PyTorch Geometric and DGL make implementation straightforward. And the demand from pharma, finance, and social media companies is growing way faster than the talent supply.

If you're looking for a specialization where you won't be competing with thousands of other engineers applying for the same role — GNNs are right there.

Low competition. High impact. The kind of opportunity that doesn't stay quiet for long.","#GraphNeuralNetworks #GNN #DeepLearning #DrugDiscovery #MachineLearning"
"37","AI Product Thinking","The most expensive mistake in AI isn't a bad model. It's solving the wrong problem.

I've watched teams spend six months building a sophisticated deep learning pipeline when a simple rules-based system would have worked fine. I've also seen the reverse — engineers insisting ""we don't need ML"" when the problem clearly needed it.

The gap isn't technical. It's product thinking.

Before writing a single line of code, I now ask: What decision does this model support? What happens when the model is wrong? Can we start with a rule-based system and only add ML if we need to? What's the actual cost of NOT having this model?

These questions have saved me months of wasted work on multiple occasions.

The evolution I've observed in senior AI engineers: they start as model builders (""give me a problem and I'll train a model""), then become systems thinkers (""let me design the whole pipeline""), and eventually become problem framers (""are we even asking the right question?"").

That last stage is where the highest impact lives. And the highest salaries.","#ProductThinking #AIStrategy #MachineLearning #ProductManagement #TechLeadership"
"38","Diffusion Models","The first time I generated an image with Stable Diffusion, I sat staring at my screen for ten minutes.

Not because the image was perfect — it wasn't. But because the implication hit me: visual content creation just became democratized. Forever.

Diffusion models are conceptually beautiful. You take an image, gradually add noise until it's pure static, then train a model to reverse the process. Generate from noise, get an image. It shouldn't work. But it does, incredibly well.

And images were just the beginning. In 2026, diffusion models generate video (Sora, Runway), 3D objects, music, molecular structures, and architectural designs.

What's practical for engineers right now: DreamBooth for personalized generation, LoRA for lightweight style transfer, ControlNet for precise control, and inpainting for targeted editing.

Companies are paying $10K-$50K for custom image generation pipelines. A client wanted product photography without photoshoots — we built a pipeline that generates realistic product images in any setting.

The tools are free. The applications are everywhere. The revenue potential is real.","#DiffusionModels #StableDiffusion #GenerativeAI #AIArt #DeepLearning"
"39","Reading Papers","I used to be terrified of ML research papers. Dense math, unfamiliar notation, 20 pages of formulas — it felt like they were written in a different language.

Then someone taught me the 3-pass method, and everything changed.

Pass 1 (5 minutes): Read the title, abstract, and look at the figures. Just decide if this paper is relevant to what you're working on. Most papers aren't, and that's fine.

Pass 2 (30 minutes): Read the introduction, skim the method, and jump to the experiments. Understand what they did and whether it worked. Skip the math.

Pass 3 (only if you're actually going to USE this): Deep dive into the implementation details and math. This is for maybe 1 in 10 papers.

I read 2-3 papers per week with this approach. Most stop at Pass 1 or 2. And that's enough to stay current.

Where to find papers: arxiv.org, Papers With Code (shows code alongside papers — incredibly useful), Hugging Face Daily Papers, and ML Twitter/X.

The best ML engineers are also the best ML readers. You don't need to understand every equation. You need to understand what works and why.","#ResearchPapers #MLResearch #ArXiv #ContinuousLearning #MachineLearning"
"40","Model Evaluation","I once deployed a model with 99.2% accuracy. The client was thrilled.

Then we discovered it was a fraud detection model where only 0.5% of transactions were fraudulent. The model was predicting ""not fraud"" for everything and achieving 99.5% accuracy by being completely useless.

Accuracy is the most misleading metric in machine learning.

For classification with imbalanced data — which is most real-world problems — precision, recall, and F1-Score tell the real story. AUC-ROC shows ranking quality. Always, always visualize the confusion matrix.

For LLM evaluation, the metrics have shifted entirely. RAGAS for RAG systems. Hallucination rate for factuality. LLM-as-Judge for scalable assessment. And human evaluation remains the gold standard, however expensive.

The model that scores 99% accuracy on a 99% majority class is worse than a coin flip on the minority class you actually care about.

Choosing the right metric is a design decision, not a formality. Get it wrong and you'll confidently deploy a model that's useless in the exact way that matters most.","#ModelEvaluation #MachineLearning #DataScience #Metrics #MLBestPractices"
"41","Cloud AI Platforms","A common mistake I see engineers make: trying to learn AWS, GCP, AND Azure simultaneously.

You end up knowing three platforms poorly instead of one platform well.

My recommendation: pick one, go deep, and be functional in the others.

If you're just starting with ML in the cloud, GCP has the cleanest experience with Vertex AI. For enterprise environments, AWS (SageMaker, Bedrock) is the market leader and what most companies use. For GenAI specifically, Azure has the edge thanks to the OpenAI partnership.

I chose GCP early in my career, got proficient, and then learned enough AWS to navigate it when clients required it. That strategy has served me well.

The fundamental concepts — model training on managed infrastructure, serving endpoints, auto-scaling, cost management — are the same across all three. Once you truly understand one, switching to another takes weeks, not months.

Master one. Be functional in the others. And don't let cloud platform choice become a source of decision paralysis that delays actually building things.","#CloudComputing #AWS #GCP #Azure #MLPlatform #MachineLearning"
"42","Synthetic Data","A healthcare client needed to train a model but couldn't share patient data due to privacy regulations. A manufacturing client had great models but only 47 examples of rare defects. A financial services client needed to test fraud detection but real fraud cases were too sensitive to distribute.

Same solution for all three: synthetic data.

The ability to generate realistic but fake data is quietly becoming one of the most important capabilities in ML. It solves privacy, scarcity, and bias problems simultaneously.

Gartner predicts 75% of enterprises will use synthetic data by 2026. I believe it. The tools have matured — Gretel.ai for general purpose, CTGAN for tabular data, diffusion models for images, and LLMs for text augmentation.

The key is validation. Synthetic data is only useful if its statistical properties match your real data. Generate without validating and you're training on fiction.

Real data is expensive, biased, and privacy-risky. Synthetic data is cheap, can be balanced, and is inherently safe. It's not a replacement for real data — it's a powerful complement.

And for the engineer who masters it, it opens doors that were previously locked by data limitations.","#SyntheticData #DataAugmentation #Privacy #MachineLearning #DataScience"
"43","Competitive Programming","People think my 1900+ LeetCode problems are about interview prep. They're wrong.

Well, partly wrong. But the real value of competitive programming for an ML engineer is how it rewires your brain.

After a few hundred problems, you start instinctively thinking about time complexity when designing data pipelines. You see optimization opportunities in feature engineering that you would have missed before. You decompose system design problems more clearly. Edge case thinking becomes automatic — which is critical when debugging production ML.

I'm not saying you need to grind 2000 problems. But consistently solving 200-300 medium-level problems will make you a fundamentally better engineer. Not just at interviews — at the actual job.

My daily routine for the past three years: two problems before work with my morning coffee. Takes about 40 minutes. It's not motivation. It's habit.

The compound effect of small daily practice is staggering. I'm a better ML engineer because of LeetCode, not despite spending time on it.

Start with one problem a day. See where you are in three months.","#LeetCode #CompetitiveProgramming #Algorithms #CodingLife #TechInterview"
"44","Model Compression","A client wanted to run a 70B parameter model. Their budget: one consumer GPU.

Three years ago, I'd have said ""impossible."" Last month, I delivered it.

Quantization has changed the game completely. INT8 gets you most of the quality at half the memory. INT4 is surprisingly good for many tasks. There are even INT2 approaches that work for specific use cases.

The real magic is in the tools: llama.cpp runs quantized models on CPUs. GPTQ and AWQ handle GPU quantization elegantly. Ollama makes running local LLMs as simple as a single command. TensorRT squeezes every drop of performance from NVIDIA hardware.

Here's the counterintuitive finding: a well-quantized 7B model frequently beats an unoptimized 13B model. Because the 7B model fits entirely in GPU memory and avoids the performance cliff of memory swapping.

Size isn't everything in AI. A model that runs fast and cheap in production beats a model that requires a data center and a massive budget.

Efficiency is an engineering skill. And in 2026, it's one of the most valuable ones.","#ModelCompression #Quantization #EdgeAI #Optimization #LLM #DeepLearning"
"45","AI in Finance","The finance industry has a dirty secret: some of the most profitable ML applications are also the most boring.

Not algorithmic trading with RL (that's the sexy one everyone talks about). I mean credit risk scoring with XGBoost. Automated document processing for compliance. Transaction monitoring for anti-money laundering. Customer churn prediction.

These aren't exciting LinkedIn content. But they're where the money is.

The fintech + AI intersection pays extremely well because the stakes are enormous — a 0.1% improvement in fraud detection can save a bank millions annually.

Skills that finance companies actually hire for: time series forecasting, anomaly detection, NLP for financial text, risk modeling, and real-time streaming with Kafka. Notice the overlap with other ML work, just with higher stakes and better compensation.

If you're an ML engineer who's willing to learn some finance domain knowledge — understanding how credit scoring works, what regulatory compliance requires, how trading systems operate — you'll find doors open very quickly.

Finance doesn't need more analysts. It needs ML engineers who understand money.","#FinTech #AIFinance #MachineLearning #AlgoTrading #QuantFinance"
