"post_number","category","post_text","hashtags"
"1","Agentic AI","I spent last weekend building an AI agent that books my flights, compares hotel prices, and sends me a summary email. Took me 14 hours.

Two years ago, that would've taken a team of three and two months.

Here's what nobody's talking about with agentic AI — it's not the technology that's hard. LangGraph, CrewAI, AutoGen... the frameworks are mature. The hard part is designing the failure modes.

My flight-booking agent confidently tried to book a $12,000 first-class ticket because I didn't set constraints properly. That's the real engineering challenge — not ""can it do the task"" but ""what happens when it does the task wrong.""

The agents that win in production aren't the smartest ones. They're the ones that fail gracefully.

If you're getting into agentic AI, spend 30% of your time on the happy path and 70% on everything that can go wrong. Trust me on this.","#AgenticAI #AIAgents #LangChain #BuildingInPublic #SoftwareEngineering"
"2","Career Growth","I interviewed 23 candidates for an ML engineer role last quarter.

19 of them had almost identical resumes — TensorFlow certification, Coursera ML specialization, a Titanic dataset project on GitHub.

The 4 who stood out? They'd actually built something messy and real.

One had a RAG chatbot for her grandmother's recipe collection. Another built a model that predicts when his houseplants need water (it was hilariously overengineered). The third automated his fantasy football drafts with ML.

None of these were ""impressive"" by traditional standards. But they showed something certificates never will — curiosity and the ability to ship.

If you're trying to break into AI/ML in 2026, stop optimizing your resume and start building something weird that you actually care about. The projects that get you hired are the ones that make interviewers lean forward and say ""wait, tell me more about that.""","#AIEngineer #CareerGrowth #MachineLearning #TechCareers #JobSearch"
"3","Multimodal AI","Something clicked for me last month when I was debugging a multimodal pipeline.

I fed the system a photo of a whiteboard from a meeting, an audio recording of the discussion, and the follow-up email thread. It synthesized all three into a coherent summary that was better than what any attendee wrote.

That's when I realized — text-only AI already feels dated. Like using a flip phone in 2026.

The interesting part isn't that models can see and hear now. It's what happens when you combine modalities. Image + audio context produces insights that neither gives alone.

If you're still building text-in, text-out applications, you're leaving 80% of the value on the table. Most real-world information isn't text. It's screenshots, voice notes, diagrams, photos.

Start experimenting with Vision Transformers and Whisper. Even a basic prototype will change how you think about AI applications.","#MultimodalAI #ComputerVision #DeepLearning #AIInnovation #BuildingAI"
"4","Edge AI","A factory I consulted for was sending 2TB of camera footage to the cloud daily just to detect defective parts on their assembly line.

Their cloud bill was astronomical. And there was a 3-second delay between a defect appearing and the alert firing. In manufacturing, 3 seconds means 6 defective units already packaged.

We moved the model to edge — a $200 NVIDIA Jetson device sitting next to the camera. Detection dropped to 40 milliseconds. Cloud costs went to nearly zero.

This is the unsexy truth about Edge AI that the hype machine misses. It's not about cool demos. It's about latency, cost, and privacy being fundamentally better when you process data where it's created.

Every time someone tells me ""just use the cloud,"" I ask them: would you trust a self-driving car that needs to ping a server before braking?

Learn TensorFlow Lite, ONNX Runtime, and model quantization. Edge is where AI gets real.","#EdgeAI #IoT #ManufacturingAI #TensorFlowLite #NVIDIA #RealTimeAI"
"5","LLM Engineering","Hot take: 95% of ""LLM applications"" I see on LinkedIn are demos, not products.

The demo: ""Look, I connected GPT to my database and it answers questions!""

The production system: It handles 10K concurrent users. It doesn't hallucinate on financial data. It costs $0.002 per query. It has fallback logic when the API is down. It logs everything for compliance. It degrades gracefully under load.

I've shipped both. The demo took an afternoon. The production system took 4 months and a team of five.

The skills that actually matter for LLM engineering aren't prompt writing. They're RAG pipeline optimization, guardrails, output validation, caching strategies, and cost modeling.

If your LLM app works great in a Jupyter notebook but you've never thought about what happens when 1,000 people use it simultaneously — you're building a toy, not a product.

And that's fine for learning! But don't confuse the two.","#LLM #LargeLanguageModels #RAG #AIEngineering #ProductionML #GenerativeAI"
"6","MLOps","The most depressing statistic in ML: 80% of models never make it to production.

I've seen this firsthand. A brilliant data scientist spends 3 months building a model with 94% accuracy. Everyone's excited. Then it sits in a notebook for 6 months because nobody knows how to deploy it.

Eventually someone manually exports it, wraps it in a Flask endpoint, and prays.

This is why I became obsessed with MLOps. Not because it's glamorous (it really isn't), but because the gap between ""model works"" and ""model is working in production, being monitored, automatically retraining, and actually making money"" — that gap is where careers are made.

If you're a data scientist reading this: learn Docker. Learn MLflow. Understand CI/CD for ML. Even just the basics.

The person who can build the model AND get it to production? That's not just an ML engineer. That's someone who's genuinely hard to replace.","#MLOps #MachineLearning #ModelDeployment #DataScience #DevOps #ProductionML"
"7","AI in Cybersecurity","A friend in cybersecurity told me something that kept me up at night.

""The attackers are using AI now. They're generating thousands of unique phishing emails per hour, each personalized to the target. No typos. Perfect grammar. Contextually relevant.""

This is the arms race nobody's ready for.

The old approach — rule-based detection, signature matching — can't keep up with AI-generated threats. You need ML fighting ML.

I've been digging into this space and honestly, the cybersecurity + AI intersection might be the most important and most understaffed area in tech right now. Anomaly detection, behavioral biometrics, NLP for threat intelligence... the applications are everywhere and the talent pool is tiny.

If you have ML skills and even a passing interest in security, explore this space. The salaries reflect the scarcity — and the work actually matters.","#Cybersecurity #AISecurity #MachineLearning #InfoSec #ThreatDetection"
"8","Career Advice","I don't have a PhD. A lot of people have opinions about that.

When I was starting out, I was told — repeatedly — that you can't be a ""real"" ML engineer without a doctorate. That I'd hit a ceiling. That I'd never be taken seriously.

250+ AI systems later, here's what I actually needed:

Strong Python skills. Enough math to understand what the models are doing (not enough to derive everything from scratch). The ability to read papers and extract what's useful. And most importantly — the discipline to build, deploy, break things, fix them, and ship.

The industry has shifted dramatically. Companies want people who can turn research into products, not people who can publish papers about papers.

If you're sitting there thinking ""I need a PhD before I can start"" — no. You need a GitHub repository with working code and the willingness to learn in public.

The barrier was never the degree. It was the belief that you needed one.","#MLEngineer #CareerAdvice #TechCareers #MachineLearning #SelfTaught #NoPhdNeeded"
"9","RAG Systems","I built a RAG system last year that worked perfectly on my test data. Deployed it. Client called within a week: ""It's giving completely wrong answers about our Q3 revenue.""

Turned out my chunking strategy was splitting financial tables right down the middle. Half the revenue data ended up in one chunk, half in another. The retrieval grabbed one half, and the LLM confidently made up the rest.

This is why RAG is deceptively hard.

The concept is simple — retrieve relevant documents, feed them to an LLM, get grounded answers. The reality is a minefield of chunking edge cases, embedding quality issues, retrieval failures, and the LLM still hallucinating even WITH the right context.

What actually moves the needle: hybrid search (semantic + keyword), re-ranking with cross-encoders, thoughtful chunk overlap, and aggressive evaluation with RAGAS.

Everyone's building RAG apps in 2026. Very few are building GOOD ones. That's your opportunity.","#RAG #LLM #VectorDatabase #AIArchitecture #GenerativeAI #LangChain"
"10","Computer Vision","The wildlife detection system I built for railway tracks at IIRS-ISRO taught me something that no course ever did.

In the lab, my model detected animals at 96% accuracy. On actual railway footage? It dropped to 71%. Rain, fog, nighttime, motion blur — real-world conditions are brutal.

I spent three months not improving the model architecture, but improving the data pipeline. Better augmentation for weather conditions. Synthetic nighttime images. Edge cases from actual field footage.

Final accuracy in production: 93%.

The takeaway that stuck with me: production computer vision is 20% model and 80% engineering. Data pipeline quality, edge deployment optimization, handling real-world conditions — that's where the actual work lives.

If you're in CV, stop chasing the latest architecture paper and start obsessing over your data quality and deployment pipeline. That's what makes the difference between a demo and a system that actually works on a rainy Tuesday night.","#ComputerVision #YOLO #DeepLearning #ISRO #AIForGood #ProductionML"
"11","Python Mastery","Confession: I used to write terrible Python.

Jupyter notebooks with cells numbered out of order. No type hints. Global variables everywhere. Functions called ""process_data_v2_final_FINAL.""

Sound familiar?

The turning point was when I had to hand off a project to another engineer. They stared at my code for two days and said, ""I genuinely can't figure out what this does."" I was mortified.

Since then I've become almost religious about production-grade Python: type hints with mypy, Pydantic for validation, FastAPI for serving, async where it matters, proper package management with uv.

The difference between a data scientist and an ML engineer isn't what models they know. It's whether another human can read, run, and maintain their code six months later.

If your code only works when you run it in the exact right order in your specific notebook — that's not engineering. That's a magic trick.

Write code like someone else will maintain it. Because they will.","#Python #SoftwareEngineering #FastAPI #MachineLearning #CleanCode #Coding"
"12","AI Ethics","We deployed a hiring model last year that looked great on paper. High accuracy, fast inference, clean API.

Then someone ran it through a fairness audit.

It was systematically rating female candidates 12% lower for engineering roles. Not because we told it to — because the training data reflected decades of biased hiring decisions, and the model learned those patterns perfectly.

We caught it before production. Many companies don't.

This is why I get frustrated when people treat AI ethics as a ""nice to have"" or something that slows innovation. Bias testing, explainability tools like SHAP and LIME, demographic parity checks — these aren't bureaucratic overhead. They're engineering requirements.

The EU AI Act is enforced now. Bias audits are becoming mandatory. But even without regulation, building AI that treats people unfairly is just bad engineering.

The model that's powerful AND fair? That's the hard problem. And the most important one.","#ResponsibleAI #AIEthics #FairnessInAI #Explainability #MachineLearning #AIGovernance"
"13","Transformers","I re-read ""Attention Is All You Need"" last week. For maybe the tenth time.

Every time I read it, I notice something new. This time it was how elegantly the positional encoding works — a solution that seems obvious in hindsight but was genuinely creative in 2017.

Here's what's wild: that paper is almost 9 years old, and it's STILL the foundation of everything. GPT, Claude, Llama, Gemini — all descendants of those 15 pages.

But transformers in 2026 look very different from 2017. Mixture of Experts for efficient scaling. State Space Models like Mamba challenging attention's dominance. Flash Attention making everything faster. KV-cache optimization that's basically its own engineering discipline.

My advice if you want to deeply understand modern AI: implement a transformer from scratch. Not using a library. From the matrix multiplications up.

It took me a weekend and it changed how I think about every model I work with. You stop seeing magic and start seeing math. And that's when you become dangerous.","#Transformers #DeepLearning #AttentionMechanism #NLP #LLM #AIResearch"
"14","Open Source AI","I remember when running a decent language model required renting a cluster of A100s.

Last Tuesday, I ran Llama 3.2 on my laptop. While on a plane. With no internet.

The open source AI ecosystem has moved so fast that I think most people haven't fully grasped what's happened. Llama, Mistral, Qwen, DeepSeek — these are genuinely good models that anyone can download, fine-tune, and deploy without paying a cent.

As a verified Hugging Face developer, I've watched this ecosystem explode from the inside. The gap between open source and proprietary models is shrinking every quarter.

And the implications for engineers are massive. You can fine-tune a world-class model on your specific domain for the cost of a few GPU hours. No API keys. No vendor lock-in. Full control.

If you're still building everything on top of paid APIs, at least explore what's possible with open source. You might be surprised how far a well-tuned 7B model can go.","#OpenSource #HuggingFace #Llama #Mistral #AI #OpenSourceAI"
"15","Data Engineering","Every time I see a LinkedIn post about some fancy new model architecture, I think about the three weeks I once spent cleaning a client's customer data.

Three weeks. Not building models. Not fine-tuning. Just figuring out why 30% of the date fields were in five different formats and why someone had entered ""yes"" in a numerical column 847 times.

Nobody posts about this. But it's 90% of the job.

The #1 bottleneck in AI has never been models. It's data. And the engineers who understand Apache Spark, dbt, data quality frameworks like Great Expectations, and proper orchestration with Airflow — they're the ones who actually get ML projects across the finish line.

I've started telling junior engineers: if you want to be an ML engineer, spend your first year becoming a really good data engineer. Learn to build pipelines that are reliable, tested, and documented.

The model is the easy part. Getting clean, reliable data to that model? That's where the real skill lives.","#DataEngineering #BigData #ApacheSpark #MachineLearning #DataQuality #DataPipelines"
"16","Fine-Tuning LLMs","I fine-tuned a Llama model on my company's internal documentation last month. The whole thing — data prep, training, evaluation — took 6 hours on a single GPU.

Two years ago, that would've cost thousands in compute. Now it costs less than a nice dinner.

QLoRA changed everything. You're training 0.1% of the model's parameters while keeping 99% of the performance. Unsloth makes it even faster. Axolotl handles the config headaches.

But here's the nuance most tutorials skip: knowing WHEN to fine-tune.

Need the model to know new facts? Use RAG, not fine-tuning.
Need the model to behave differently — match a tone, follow a specific format, reason in a domain-specific way? That's when you fine-tune.

I see teams wasting weeks fine-tuning to add knowledge when they should've built a RAG pipeline. And vice versa.

The best results come from doing both. But knowing which tool fits which problem is the real skill.","#FineTuning #LLM #QLoRA #LoRA #HuggingFace #DeepLearning #GenerativeAI"
"17","AI in Healthcare","A doctor I work with told me: ""Your model caught a tumor that I missed on the first read.""

That sentence haunts me — in the best possible way.

AI in healthcare isn't a futuristic concept. It's happening now. Cancer detection from medical images that rivals (and sometimes exceeds) radiologist accuracy. Drug discovery timelines compressed from years to weeks. Predictive monitoring that alerts nurses before a patient deteriorates.

But here's what tech people get wrong about healthcare AI: the hardest part isn't the model. It's the trust, the regulation, and the integration into actual clinical workflows.

You can build the most accurate diagnostic model in the world. If doctors don't trust it, or if it doesn't fit into their workflow, or if it's not HIPAA compliant — it collects dust.

If you want to do meaningful AI work, healthcare is where technology meets real impact. But bring humility with your PyTorch skills. You're entering a domain where mistakes have consequences beyond a bad user experience.","#HealthcareAI #MedTech #AIForGood #DeepLearning #DigitalHealth"
"18","Vector Databases","A year ago, most ML engineers I talked to had never heard of vector databases. Now it's in every other job description.

Here's the quick version of why they matter: modern AI represents everything as high-dimensional vectors (embeddings). To find similar items — whether it's documents for RAG, products for recommendations, or images for search — you need a database optimized for similarity search on those vectors.

Traditional databases are built for exact matches. Vector databases are built for ""find me the closest thing to this.""

I've used most of them at this point. Pinecone if you want managed and production-ready. Weaviate for feature-rich open source. Chroma for quick prototyping. Qdrant if you care about performance. pgvector if you're already married to PostgreSQL.

My honest recommendation for most people starting out: Chroma for learning, then Qdrant or Weaviate for production.

Understanding embeddings and vector search isn't optional anymore for AI engineers. It's the new SQL — foundational knowledge you're expected to have.","#VectorDatabase #Embeddings #RAG #SemanticSearch #AIEngineering #LLM"
"19","GPU Programming","I saved a client $95/day on inference costs. Their first reaction: ""How?"" My answer: ""I learned CUDA.""

Most ML engineers treat PyTorch as a black box. Tensors go in, predictions come out, and whatever happens on the GPU is someone else's problem.

That's fine until you're paying $100/day for inference that should cost $5.

Understanding GPU optimization — CUDA basics, Triton for custom kernels, Flash Attention, mixed precision training, quantization — is the closest thing to a salary cheat code in AI. The supply of people who understand this stuff is tiny. The demand is enormous.

I'm not saying everyone needs to write raw CUDA. But understanding WHY quantizing from fp16 to int4 works, or HOW continuous batching improves throughput, or WHAT Flash Attention actually does differently — that knowledge compounds in every project you touch.

The engineers who can make models run faster and cheaper will always have job security. Because compute costs are the #1 line item killing AI startups.","#CUDA #GPU #NVIDIA #DeepLearning #ModelOptimization #AIEngineering"
"20","AI Agents Framework","Last weekend I built an agent that researches a topic, writes a draft blog post, critiques its own draft, revises it, and emails me the final version. Total time to build: about 6 hours.

A year ago, that was a research project. Now it's a weekend build.

The agent framework landscape has matured incredibly fast. LangGraph for complex stateful workflows. CrewAI for multi-agent collaboration. AutoGen if you're in the Microsoft ecosystem. Phidata for production-focused builds.

But the thing tutorials don't teach you — memory management and error recovery are 70% of the work. Making the agent DO the task is step one. Making it handle failures, remember context across steps, and know when to ask for human help? That's the real engineering.

My biggest lesson from building agents: the ones that work best aren't the most autonomous. They're the ones with the clearest boundaries around when they should stop and ask a human.

Full autonomy is a demo. Thoughtful human-in-the-loop is a product.","#AIAgents #LangGraph #CrewAI #AutoGen #LLM #Automation"
"21","Prompt Engineering","Unpopular opinion: ""Prompt Engineer"" as a job title has maybe 18 months left.

Not because prompting doesn't matter — it absolutely does. But because it's being absorbed into everything else.

When every developer uses structured outputs, function calling, and tools like DSPy for prompt optimization, ""prompt engineering"" stops being a specialty and becomes a baseline skill. Like knowing Git.

What's actually emerging is something I'd call Prompt Architecture — designing systems that automatically generate the right prompt for the right context. Not writing individual prompts by hand, but building the infrastructure that handles prompting at scale.

The engineer who manually crafts beautiful prompts? Valuable today.

The engineer who builds systems that craft thousands of context-aware prompts automatically? Valuable forever.

If you're a prompt engineer, don't panic. But start learning the systems layer. That's where the career longevity lives.","#PromptEngineering #LLM #GenerativeAI #DSPy #AIArchitecture #CareerAdvice"
"22","Kubernetes for ML","I avoided learning Kubernetes for two years. ""I'm an ML engineer, not a DevOps person,"" I told myself.

Then I needed to deploy a model that scaled from 100 to 10,000 requests per hour depending on the time of day. And I realized I was the bottleneck on my own team.

Here's the reality: ""Must know Kubernetes"" is in almost every ML engineer job description now. Not deep K8s expertise — nobody expects you to configure networking from scratch. But deploying a model on K8s, scaling inference pods, managing GPU resources, and understanding KubeFlow or KServe? That's expected.

The combination of ML + DevOps is the most in-demand skill mix I've seen. Because teams are tired of having brilliant model builders who can't get anything into production without hand-holding.

You don't need to become a K8s expert. But if you can deploy your own models, scale them, and monitor them? You just became worth 30% more.","#Kubernetes #MLOps #DevOps #CloudComputing #ModelDeployment #KubeFlow"
"23","AI for Climate","I built wildlife detection systems for railway tracks at ISRO. The goal was simple: stop trains from hitting animals.

That project changed how I think about AI.

Most AI discourse is about chatbots, image generators, and productivity tools. But some of the most important applications are in climate and conservation — satellite imagery for deforestation tracking, weather prediction models that outperform traditional forecasting, energy grid optimization, wildlife monitoring.

Google's GenCast already beats traditional weather models. There are teams using computer vision to count endangered species from drone footage. Others optimizing wind farm placement with ML.

The planet doesn't need another chatbot wrapper. It needs engineers who point these incredibly powerful tools at problems that actually matter.

If you're looking for AI work that lets you sleep well at night, environmental applications are wide open and desperately understaffed.

What environmental problem would you solve with AI if you had unlimited resources?","#ClimateAI #Sustainability #AIForGood #ISRO #RemoteSensing #GreenTech"
"24","Interview Prep","I bombed my first ML interview. Completely.

They asked me to design a recommendation system at scale and I rambled about model architectures for 20 minutes without once mentioning data pipelines, serving infrastructure, or monitoring.

The interviewer politely said, ""We need engineers, not researchers.""

That hurt. But it taught me what ML interviews actually test in 2026:

The coding round is still LeetCode Medium — no surprises there. ML theory is standard (bias-variance, regularization). But then comes LLM system design, which is now mandatory. ""Design a RAG system for internal documents."" ""How would you evaluate an LLM-powered customer service agent?""

The biggest change from a few years ago: they want to hear about production failures. ""Tell me about a time your model broke in production"" is basically guaranteed. And they want real answers, not polished stories.

After 1900+ LeetCode problems I can tell you — preparation compounds. But don't just grind problems. Practice explaining your design decisions out loud. That's what actually gets you the offer.","#MLInterview #TechInterview #CareerAdvice #MachineLearning #CodingInterview"
